TITLE,YEAR,LANG,EDITORA,AUTHOR,ORDER,ORDER_OK
Museu Revelado: o fardo da história não revelada,2013,Português,Prefeitura Municipal de Belo Horizonte,['Rodrigo Vivas Andrade'],['1'],['1']
Introdução,2013,Português,Prefeitura Municipal de Belo Horizonte,"['Rodrigo Vivas Andrade', 'Sérgio Rodrigo Reis']","['1', '2']",['1']
A Arte que não estava lá,2014,Português,Editora da Prefeitura de Belo Horizonte,['Rodrigo Vivas Andrade'],['1'],['1']
1944. Do pincel à gilete: a arte moderna em Belo Horizonte,2016,Português,RioBooks,['Rodrigo Vivas Andrade'],['1'],['1']
Presença e invisibilidade,2020,Português,Arte Vivas Editora,"['Rodrigo Vivas Andrade', 'Sandra Makowiecky', 'Márcio Sampaio']","['1', '2', '3']",['1']
A história e a crítica de arte: construção do valor artístico,2020,Português,Arte Vivas Editora,"['Rodrigo Vivas Andrade', 'Sandra Makowiecky', 'Márcio Sampaio', 'Celma Alvim']","['1', '2', '3', '4']",['1']
Abrangência da crítica de arte de Celma Alvim,2020,Português,Arte Vivas,"['Rodrigo Vivas Andrade', 'Sandra Makowiecky', 'Márcio Sampaio', 'Celma Alvim']","['1', '2', '3', '4']",['1']
Salões de Arte da Prefeitura de Belo Horizonte na década de 1970: do conceitual à artesania,2021,Português,Universidade Federal de Juiz de Fora,['Rodrigo Vivas Andrade'],['1'],['1']
