TITLE,YEAR,LANG,EDITORA,AUTHOR,ORDER,ORDER_OK
Treino da Função Executiva Utilizando-se a Composição Musical Grupal na Esclerose Múltipla e Neuromielite Óptica,2014,Português,Faculdades EST,"['Maycon Abreu', 'Welder Ramon Mendes Silveira', 'Marco Aurélio Lana Peixoto', 'Cybelle Maria Veiga Loureiro']","['1', '2', '3', '4']",['4']
Respostas Comportamentais do Prematuro de Risco à Musicoterapia,2014,Português,Faculdades EST,"['Maria Noeme Pereira', 'Welder Ramon Mendes Silveira', 'Paulo Marcos Cerqueira', 'Cybelle Maria Veiga Loureiro']","['1', '2', '3', '4']",['4']
O efeito da musicoterapia na alteração dos estados de alerta do prematuro,2014,Português,Faculdades EST,"['Welder Ramon Mendes Silveira', 'Simone Samagaio', 'Paulo Marcos Cerqueira', 'Cybelle Maria Veiga Loureiro']","['1', '2', '3', '4']",['4']
MEMÓRIA MUSICAL PRESERVADA NA DEMÊNCIA SEMÂNTICA: UM ESTUDO PRELIMINAR,2019,Português,Atena Editora,['Cybelle Maria Veiga Loureiro'],['1'],['1']
MEASURING THE STRUCTURAL VALIDITY OF TWO NORDOFF-ROBBINS SCALES FOR A PATIENT WITH TUBEROUS SCLEROSIS,2021,Português,Atena Editora,"['ANDRÉ, ALINE MOREIRA BRANDÃO', 'GOMES, CRISTIANO MAURO ASSIS', 'Cybelle Maria Veiga Loureiro']","['1', '2', '3']",['3']
MEASURING THE STRUCTURAL VALIDITY OF TWO NORDOFF-ROBBINS SCALES FOR A PATIENT WITH AUTISM,2021,Português,Editora Artemis,"['Moreira Brandão André, Aline', 'GOMES, CRISTIANO MAURO ASSIS', 'Cybelle Maria Veiga Loureiro']","['1', '2', '3']",['3']
CONFIABILIDADE INTER-EXAMINADORES DA VERSÃO BRASILEIRA DA ESCALA NORDOFF ROBBINS DE COMUNICABILIDADE MUSICAL,2020,Português,Editora Artemis,"['Moreira Brandão André, Aline', 'Mauro Assis Gomes, Cristiano', 'Cybelle Maria Veiga Loureiro']","['1', '2', '3']",['3']
