TITLE,YEAR,DOI,LANG,JOURNAL,QUALIS,ISSN,AUTHOR,ORDER,ORDER_OK,JCR
George Tabori: Entre Catacumbas e Catedrais. ISSN: 1982-7180,2008,,Português,Cavalo Louco,C,1982-7180,['Mara Lucia Leal'],['1'],['1'],-99
Anjo Negro: sexo e raça no teatro brasileiro,2018,10.5965/1414573101162011067,Português,Urdimento (UDESC),A1,1414-5731,['Mara Lucia Leal'],['1'],['1'],-99
QUAL É A MINHA COR?,2009,10.7867/2236-6644.2009v15n15p26-32,Português,O Teatro Transcende (Online),C,2236-6644,['Mara Lucia Leal'],['1'],['1'],-99
PERFORMANCE E GÊNERO: ELA É UMA PRINCESA!,2017,,Português,aParte XXI,C,2179-9555,"['André Luiz Silva Rodovalho', 'Mara Lucia Leal']","['1', '2']",['2'],-99
Encontro de Compartilhamento,2017,10.14393/issn2358-3703.v4n1a2017-13,Português,RASCUNHOS - CAMINHOS DA PESQUISA EM ARTES CÊNICAS,A4,2358-3703,"['Mara Lucia Leal', 'FABIÃO, ELEONORA']","['1', '2']",['1'],-99
Pedagogias feministas e de(s)coloniais nas artes da vida,2017,10.14393/ouv20-v13n1a2017-2,Português,OUVIROUVER (ONLINE),XX,1983-1005,"['Adriana Schneider Alcure', 'Camila Bastos Barcelar', 'Mara Lucia Leal', 'Maria Thereza de Oliveira Azevedo']","['1', '2', '3', '4']",['3'],-99
Eu vou te contar minha vida e todas as variações são válidas,2018,,Português,Revista Vazantes,B3,2594-5491,['Mara Lucia Leal'],['1'],['1'],-99
"Tensionamentos presentes em algumas montagens e desmontagens do grupo cultural Yuyachkani Antígona, Adiós Ayacucho e Hijo de Perra o la Anunciación",2021,10.14393/issn2358-3703.v8n1a2021-06,Português,RASCUNHOS - CAMINHOS DA PESQUISA EM ARTES CÊNICAS,A4,2358-3703,"['Mara Lucia Leal', 'ANTONIO ALVES BARBOSA MELLO NETO']","['1', '2']",['1'],-99
Editorial - Em trabalho de cura,2021,10.5965/1414573101402021e0901,Português,Urdimento - Revista de Estudos em Artes Cênicas,A1,2358-6958,"['ROSA, ANDRÉ LUÍS', 'JACOBS, DAIANE DORDETE STECKERT', 'LEAL, DODI', 'AZEVEDO, JOSÉ FERNANDO PEIXOTO DE', 'Mara Lucia Leal', 'VOMERO, MARIA FERNANDA']","['1', '2', '3', '4', '5', '6']",['5'],-99
